{
  "meta": {
    "data": "2026-03-21",
    "tipo": "workout",
    "valutazione": 9,
    "esito": "APPROVATA",
    "numero_review": 1
  },
  "correzioni_applicate": [],
  "problemi_critici": [],
  "suggerimenti": [
    {
      "id": "S1",
      "descrizione": "Face pull al cavo potrebbe sollecitare la spalla con TOS attiva",
      "motivazione": "Il face pull coinvolge abduzione e rotazione esterna della spalla. Sebbene il carico sia molto leggero (RPE 5-6), con una TOS attiva da infiammazione del piccolo pettorale, qualsiasi movimento che porta il braccio in abduzione potrebbe irritare la zona. La scheda stessa dichiara 'ZERO sollecitazione del piccolo pettorale, spalla e movimenti overhead' e nelle note generali esclude 'spalla (adduzione/abduzione)'. Il face pull prevede abduzione della spalla.",
      "proposta": "Sostituire il face pull con band pull-apart a braccia tese davanti al petto (movimento piu' controllato, meno abduzione) oppure eliminarlo del tutto e aggiungere un esercizio di core o lower body. Se l'atleta vuole mantenerlo, eseguire SOLO se completamente asintomatico e con carico minimo, monitorando attentamente."
    },
    {
      "id": "S2",
      "descrizione": "Stretching pettorale piccolo nel defaticamento potrebbe essere prematuro",
      "motivazione": "Il defaticamento prevede 'corner stretch o doorway stretch 2x30s DELICATAMENTE' per il pettorale piccolo. Se la TOS e' causata da infiammazione/contrattura del piccolo pettorale, lo stretching diretto nella fase acuta potrebbe irritare ulteriormente il tessuto infiammato. Questa indicazione andrebbe coordinata con il fisioterapista.",
      "proposta": "Aggiungere una nota esplicita: 'Lo stretching del piccolo pettorale va eseguito SOLO su indicazione del fisioterapista. Se il fisioterapista non lo ha ancora autorizzato, saltare questo punto del defaticamento.' Questo protegge l'atleta senza rimuovere l'indicazione."
    },
    {
      "id": "S3",
      "descrizione": "Volume serie squat S2 passa da 3x5 a 4x4 — salto di volume totale significativo",
      "motivazione": "Settimana 1 Lunedi: squat 3x5 = 15 reps totali a 87 kg. Settimana 2 Lunedi: squat 4x4 = 16 reps totali a 95 kg. L'aumento di carico (+9%) e' gia' appropriato, ma passare da 3 a 4 serie aggiunge anche un set extra dopo sole 2 sessioni di ripresa post-stop. Per una fase di recupero, sarebbe piu' conservativo mantenere 3 serie e aumentare solo il carico.",
      "proposta": "Mantenere 3x5 a 95 kg nella S2 (stesso schema, solo carico aumentato). Analogamente per lo stacco S2 che passa da 3x5 a 4x4: mantenere 3x5 a 129 kg. Questo mantiene il volume costante e isola la variabile intensita'."
    },
    {
      "id": "S4",
      "descrizione": "Aggiungere indicazione esplicita sulla posizione del bilanciere nello squat",
      "motivazione": "Con TOS attiva, la posizione del bilanciere sulle spalle nello squat e' rilevante. La posizione high bar richiede meno mobilita' di spalla rispetto alla low bar. Se l'atleta usa normalmente la low bar, potrebbe avere fastidio nel portare le braccia indietro per supportare il bilanciere.",
      "proposta": "Aggiungere nelle note sessione del primo squat: 'Posizione HIGH BAR consigliata per ridurre lo stress sulla spalla. Se la presa del bilanciere causa fastidio, usare una presa piu' larga o provare safety squat bar se disponibile in palestra.'"
    }
  ],
  "punti_di_forza": [
    "Esclusione completa e rigorosa di tutti gli esercizi che coinvolgono pettorale, overhead press, trazioni e dip — piena aderenza alle restrizioni TOS",
    "Calcoli percentuali 1RM tutti corretti e verificati (60%, 63%, 65% su squat 145.8 e stacco 198.3)",
    "Progressione conservativa e graduale tra S1 (60%) e S2 (65%) — incremento del 5% appropriato per fase di recupero",
    "Note generali estremamente dettagliate con segnali di stop chiari, raccomandazioni nutrizionali coerenti con il piano (mantenimento, no cut), e indicazione fisioterapia",
    "Coerenza totale con il piano annuale: Fase 0, 2 settimane, nessun test day, carichi conservativi, obiettivo di ripresa graduale",
    "Buona varieta' di esercizi lower body (squat, stacco convenzionale, stacco rumeno, leg press, leg curl) e core (plank, dead bug, ab wheel, pallof press)",
    "Sessione conclusiva S2 Venerdi ben strutturata come 'verifica tecnica' con indicazione chiara su come procedere (se sintomi persistono, ripetere Fase 0)",
    "RPE target coerenti con le percentuali indicate (60-65% 1RM = RPE 6-7, corretto per un intermedio)",
    "Inclusione intelligente del rematore con specifiche precise sull'angolazione del busto (30-45 gradi) per proteggere la spalla"
  ]
}