{
  "meta": {
    "data": "2026-03-21",
    "tipo": "workout",
    "valutazione": 9,
    "esito": "APPROVATA",
    "numero_review": 1
  },
  "correzioni_applicate": [],
  "problemi_critici": [],
  "suggerimenti": [
    {
      "id": "S1",
      "descrizione": "Incoerenza tra progressione dichiarata e progressione effettiva sullo stacco",
      "motivazione": "Il mesociclo e le note_generali dichiarano '+5 kg/settimana sui compound', ma lo stacco progredisce di +10 kg/settimana (S1: 110 kg, S2: 120 kg, S3: 130 kg). La nota della settimana 2 esplicita '+10 kg sullo stacco' contraddicendo la regola generale. Questo crea confusione per l'atleta che legge istruzioni contrastanti.",
      "proposta": "Allineare la descrizione nel mesociclo e nelle note_generali alla progressione reale: scrivere '+5 kg/settimana sullo squat, +10 kg/settimana sullo stacco' oppure uniformare lo stacco a +5 kg/settimana (110 -> 115 -> 120). La progressione +10 kg e' accettabile dato che lo stacco parte dal 55% 1RM, ma la documentazione deve essere coerente."
    },
    {
      "id": "S2",
      "descrizione": "S4 Upper Safe dichiara carichi ridotti ma i pesi sono aumentati rispetto a S3",
      "motivazione": "La nota sessione del Martedi S4 dice 'Carichi ridotti rispetto a settimana 3', ma i pesi effettivi sono tutti superiori: Lat Machine 55 -> 60 kg (+5), Rematore 50 -> 55 kg (+5), Face Pull 15 -> 17.5 kg (+2.5). In una settimana di scarico pre-test i carichi dovrebbero essere ridotti, non aumentati, per favorire la supercompensazione.",
      "proposta": "Ridurre i carichi della S4 Upper rispetto a S3: Lat Machine 50 kg, Rematore 45 kg, Face Pull 12 kg (circa -10/15% rispetto a S3). Oppure, se si intende mantenere una leggera progressione, correggere la nota rimuovendo il riferimento a 'carichi ridotti'."
    },
    {
      "id": "S3",
      "descrizione": "S3 Giovedi (Stacco + RDL) manca completamente il lavoro core",
      "motivazione": "Tutte le altre sessioni della scheda includono almeno 2 esercizi di core (plank, dead bug, pallof press), ma il Giovedi di settimana 3 ha solo Stacco, RDL, Leg Extension e Calf Raise. Il rinforzo core e' fondamentale in ogni sessione come prevenzione infortuni lombari, specialmente nei giorni di stacco con carichi crescenti.",
      "proposta": "Aggiungere almeno 1-2 esercizi core al Giovedi S3: Dead Bug 3x10 per lato e/o Pallof Press 3x10 per lato. Questo allinea la sessione al protocollo delle altre giornate e rinforza la stabilita' del core durante la progressione dello stacco."
    },
    {
      "id": "S4",
      "descrizione": "Progressione Leg Press molto aggressiva per una fase di recupero",
      "motivazione": "La Leg Press progredisce di +20 kg/settimana (S1: 120 kg, S2: 140 kg, S3: 160 kg), con salti del 17% a settimana. Anche se e' un esercizio accessorio a basso rischio, nella filosofia di una fase di ripresa graduale i salti dovrebbero essere piu' contenuti e proporzionati a quelli dei compound principali (+5-10 kg).",
      "proposta": "Moderare la progressione della Leg Press: S1 120 kg, S2 130 kg, S3 140 kg (+10 kg/settimana). Questo mantiene una progressione piu' coerente con il messaggio conservativo della scheda."
    }
  ],
  "punti_di_forza": [
    "Gestione esemplare dell'infortunio TOS: lista esaustiva degli esercizi vietati, soglie di dolore quantificate (scala 0-10 con azioni a 2/10 e 4/10), condizione obbligatoria di assenza sintomi per introdurre l'Upper, alternative concrete (goblet squat se disagio alla presa del bilanciere).",
    "Introduzione condizionata della sessione Upper in settimane 3-4 con esercizi ben selezionati (lat machine presa larga, rematore cavo presa neutra, face pull) che evitano completamente il coinvolgimento del piccolo pettorale.",
    "Test Day submassimale ben strutturato: protocollo di riscaldamento progressivo con salti appropriati, target conservativi (~88-90% e non 1RM assoluto), tentativi condizionati a RPE del set precedente, panca esplicitamente esclusa.",
    "Tutte le percentuali 1RM sono calcolate correttamente e coerenti con i massimali stimati (Squat 145.8, Stacco 198.3).",
    "Progressione lineare ben calibrata sullo squat (+5 kg/settimana da 62% a 68% 1RM) con scarico pre-test adeguato.",
    "Protocollo di riscaldamento e defaticamento completo con stretching specifico per TOS (piccolo pettorale, scaleni) incluso sia nelle sessioni che nei giorni di riposo.",
    "Note generali dettagliate e operative: criteri chiari per procedere alla Fase 2, raccomandazione fisioterapia, istruzioni nutrizionali coerenti con il piano annuale.",
    "Settimana 4 strutturata intelligentemente come scarico pre-test con riduzione volume e intensita' sui compound (3x5 squat a 62%, 3x3 stacco a 60%) per favorire la supercompensazione."
  ]
}
